{
  "$schema": "https://json-schema.org/draft/2020-12/schema",
  "$id": "https://github.com/sw00t/Claude-Blog-Condenser/data/posts.schema.json",
  "title": "posts.json",
  "description": "Generated by the ingestion agent. Do not hand-edit. The agent MUST validate against this file before committing; on any validation failure it commits nothing and files a GitHub issue instead.",
  "type": "object",
  "additionalProperties": false,
  "required": ["version", "generated_at", "window_days", "source_url", "posts"],
  "properties": {
    "version": {
      "const": 1,
      "description": "Bump only alongside a breaking change to this schema."
    },
    "generated_at": {
      "type": "string",
      "format": "date-time",
      "description": "UTC timestamp of the run that produced this file, RFC 3339."
    },
    "window_days": {
      "type": "integer",
      "minimum": 1,
      "description": "Retention window in effect for this run, copied from config.json."
    },
    "source_url": {
      "type": "string",
      "format": "uri",
      "description": "Index or feed URL the posts were discovered from."
    },
    "posts": {
      "type": "array",
      "items": { "$ref": "#/$defs/post" },
      "description": "Sorted by published_at descending. Every id must be unique."
    }
  },
  "$defs": {
    "post": {
      "type": "object",
      "additionalProperties": false,
      "required": [
        "id",
        "url",
        "title",
        "published_at",
        "tldr",
        "body_text",
        "word_count",
        "fetched_at",
        "content_hash"
      ],
      "properties": {
        "id": {
          "type": "string",
          "pattern": "^[a-z0-9]+(?:-[a-z0-9]+)*$",
          "minLength": 1,
          "maxLength": 200,
          "description": "Stable slug derived from the post URL path. Must not change once assigned."
        },
        "url": { "type": "string", "format": "uri" },
        "title": { "type": "string", "minLength": 1, "maxLength": 300 },
        "published_at": {
          "type": "string",
          "format": "date",
          "pattern": "^[0-9]{4}-[0-9]{2}-[0-9]{2}$",
          "description": "Publication date, YYYY-MM-DD. If the source gives only a coarse date, use it verbatim; never invent precision."
        },
        "authors": {
          "type": "array",
          "items": { "type": "string", "minLength": 1 },
          "default": []
        },
        "tags": {
          "type": "array",
          "items": { "type": "string", "minLength": 1 },
          "default": []
        },
        "tldr": {
          "type": "string",
          "minLength": 1,
          "maxLength": 600,
          "description": "Agent-written summary, grounded in body_text only. NOTE: the word bounds in config.tldr are a quality rule enforced by the runbook, NOT by this schema. A TL;DR outside those bounds still validates here and must be rewritten in-run, never escalated as a validation failure."
        },
        "body_text": {
          "type": "string",
          "minLength": 1,
          "description": "Plain-text article body. No markup, no navigation chrome, no footer boilerplate."
        },
        "word_count": {
          "type": "integer",
          "minimum": 1,
          "description": "Whitespace-delimited word count of body_text."
        },
        "category": {
          "type": "string",
          "minLength": 1,
          "maxLength": 60,
          "description": "Category as printed on the blog index card, verbatim. Omit if the card shows none."
        },
        "figures": {
          "type": "array",
          "default": [],
          "description": "In-article figures, in document order. Each n corresponds to a [[figure:n]] marker in body_text.",
          "items": {
            "type": "object",
            "additionalProperties": false,
            "required": ["n", "src"],
            "properties": {
              "n": { "type": "integer", "minimum": 1 },
              "src": { "type": "string", "format": "uri" },
              "alt": { "type": "string" },
              "caption": { "type": "string" }
            }
          }
        },
        "fetched_at": { "type": "string", "format": "date-time" },
        "content_hash": {
          "type": "string",
          "pattern": "^[a-f0-9]{64}$",
          "description": "SHA-256 of body_text. Drives change detection across runs."
        }
      }
    }
  }
}
