{
  "version": 1,
  "generated_at": "2026-09-27T16:43:52Z",
  "window_days": 35,
  "source_url": "https://claude.com/blog",
  "posts": [
    {
      "id": "build-plugins-for-claude",
      "url": "https://claude.com/blog/build-plugins-for-claude",
      "title": "Build plugins for Claude",
      "published_at": "2026-09-25",
      "body_text": "Every day, millions of people connect Claude to their apps, work tools, and data. Today, we're making it easier for developers to reach them.\n\nPlugins package MCP connectors, Agent Skills, or both, and are the main way to build third-party extensions for Claude. Build a plugin, submit it through the new directory submission portal, and once approved, it's listed in the Claude directory.\n\n‍Submit and track plugins in the directory submission portal\n\nThe directory submission portal is open to developers on paid Claude plans. There are two ways to submit and get your plugin published in the Claude directory:\n\nSingle MCP connector: point to your remote MCP server.\n\nPlugin bundle: combine MCP servers and skills, host them on GitHub, and submit the repo. In Claude Code, plugins can also include LSPs, commands, hooks, and agents.\n\nWhichever path you choose, the portal will guide you from submission to launch. You can:\n\nAuto-validate your plugin. Each submission is checked and safety-scanned as soon as you submit, so you catch issues early.\n\nReview status and feedback. See where your plugin is in the review process, results from the safety scan, and recommended changes.\n\nPublish when you’re ready. Once approved, you decide when to publish your plugin in Claude.\n\n[[figure:1]]\n\nMonitor and improve your plugin once it's published\n\nOnce your plugin is live, usage analytics show installs by product surface and version, so you can prioritize fixes and features for your users. On the discovery side, you’ll see how often your listing is viewed and which searches lead people to it, so you can refine it to reach new users.\n\n[[figure:2]]\n\nBring a rich experience to users with MCP 2.0 and its extensions\n\nClaude supports the latest MCP spec, commonly referred to as MCP 2.0, which includes a stateless core. You can improve the experience of using your plugin with two MCP extensions: MCP Apps, for interactive UI inside chat, and Enterprise Managed Auth, for zero-touch OAuth for enterprise users. Support for more MCP features and extensions is coming soon.\n\nStart building plugins for Claude\n\nPlugins are the main way for third-party developers to create extensions for Claude. Over the coming weeks, one discovery experience will roll out across Claude and Claude Code.\n\nSkills and MCP connectors stay as building blocks, and the Claude directory will continue to list them. In the future, developers will be able to turn their connector listing into a plugin. If you have an existing skill, connector, or plugin on the Claude directory, you do not need to make any changes.\n\nTo get started with building plugins, read our docs for how to build a plugin and submit your plugin here.",
      "word_count": 442,
      "fetched_at": "2026-09-27T16:43:42Z",
      "content_hash": "cd48978d5ccbb93d6a13244afd1c39289458fe08fabe172181fb4ab666c80651",
      "tags": [
        "Claude apps"
      ],
      "category": "Product announcements",
      "figures": [
        {
          "n": 1,
          "src": "https://cdn.prod.website-files.com/68a44d4040f98a4adf2207b6/6ab6a76f77cf7911a03be1bd_d852ff4a.png",
          "caption": "Stylized view of review status and recommended changes for a plugin. Data is illustrative."
        },
        {
          "n": 2,
          "src": "https://cdn.prod.website-files.com/68a44d4040f98a4adf2207b6/6ab6a76f77cf7911a03be1c0_ec09f8b2.png",
          "caption": "Stylized view of usage metrics for a published plugin. Data is illustrative."
        }
      ],
      "tldr": "Anthropic now enables developers on paid plans to build and submit plugins for Claude through a new directory submission portal. Plugins combine MCP connectors and Agent Skills, with auto-validation, status tracking, usage analytics, and support for MCP 2.0 features like interactive UI and enterprise authentication."
    },
    {
      "id": "claude-tag-now-supports-personal-connectors-in-channels",
      "url": "https://claude.com/blog/claude-tag-now-supports-personal-connectors-in-channels",
      "title": "Claude Tag now supports personal connectors in channels",
      "published_at": "2026-09-24",
      "body_text": "Claude Tag (beta) lets you add Claude to a Slack channel, where it works alongside your team. Until now, Claude could only use the connectors an admin attached to the channel, and most organizations keep that list short on purpose: they want access to follow the person, not the channel.\n\nNow Claude can use your own connectors for a request you make in a channel. For example, your calendar, your drive, your assigned accounts on the CRM, or your staging deploys. If you have connected it to your Claude account, you can access it in the channel.\n\nYou decide how information is surfaced from when you ask Claude to access your connectors. You can review each response before it posts. Alternatively, you can use auto mode to post automatically unless Claude determines there is sensitive content that needs your review. On Enterprise plans, admins will be able to require review for everyone.\n\nPersonal connectors provide admins more governance options. They can provide access to a shared set of tools under an agent identity, have channel members only use personal connectors to rely on existing role-based access, or decide tool by tool.\n\nPersonal connectors in Claude Tag are rolling out now on Team plans, with Enterprise to follow.\n\nUsing personal connectors\n\nMost of what people need in a channel sits behind their own login: a time that works on your calendar, your open deals, a plan only you can open. Now you can ask for those in the channel too.\n\nFor example, here's Priya in #checkout-migration, a channel connected to GitHub. She asks: \"@Claude check my Google Drive doc 'Checkout migration, Q3' against what we've shipped. What's still open?\"\n\n[[figure:1]]\n\nClaude reads the merged pull requests through the channel's GitHub connector. The doc is one only Priya can open. Before, Claude would have stopped there.\n\nNow Claude reads the doc through Priya's Google Drive connector, separately from the channel's work, and posts what shipped and what's left. Priya's plan isn't sensitive, so she uses auto mode and Claude screens the comparison before it posts. For a document she'd rather check first, she can switch to review mode and see the response before the channel does.\n\n[[figure:2]]\n\nEverything Claude does through your connector appears in that tool's own log under your account, the way your direct-message work does today. The channel's own work stays under its service account, the one your security team already follows.\n\nYou decide what Claude reaches and what the channel sees, the same as when you use your connectors in a direct message, and you can disconnect a connector at any time.\n\nWhere the channel's own connectors still matter\n\nPersonal connectors don't run unattended. Scheduled routines, and anything Claude starts on its own, use the connectors an admin attached to the channel. Tools that are needed for unattended actions, or actions the entire channel relies on, should use shared connectors.\n\nFor example, you may want to add Claude to your #on-call channel to help with CI triage and response. Claude can identify and help remediate issues (even after work hours) if you set up shared connectors to your runbook, monitoring tools, and deployment history.\n\nA channel that solely relies on personal connectors suits closely supervised work. For example, collaboratively drafting an RFP response may require pulling data from pricing or other sensitive sources that are not provisioned to the entire channel. Anything Claude posts is visible to everyone in the channel.\n\nWhat's next\n\nThere's nothing to install. When a request of yours needs one of your connectors, Claude asks you the first time, then uses it in the thread.\n\nAsk @Claude in a channel for what only you can reach. Learn more about Claude Tag.",
      "word_count": 617,
      "fetched_at": "2026-09-27T16:43:44Z",
      "content_hash": "d1269bf9afed83e41116714079a21c25d1dbaa4a91a2f3bd22a65b1a6382c940",
      "tags": [
        "Claude Tag"
      ],
      "category": "Product announcements",
      "figures": [
        {
          "n": 1,
          "src": "https://cdn.prod.website-files.com/68a44d4040f98a4adf2207b6/6ab5827f9ff0fe18888b5382_08c194d9.png",
          "caption": "Priya asks Claude in #checkout-migration to check her plan against what shipped. The channel reaches GitHub. Only Priya can open the doc."
        },
        {
          "n": 2,
          "src": "https://cdn.prod.website-files.com/68a44d4040f98a4adf2207b6/6ab5827f9ff0fe18888b5385_d06075ed.png",
          "caption": "The same thread. Claude's reply with the comparison, and the review prompt showing what will post before it does."
        }
      ],
      "tldr": "Claude Tag now allows users to access their personal connectors within Slack channels, enabling Claude to retrieve individual data like calendars and documents alongside shared channel connectors. The feature rolls out on Team plans with Enterprise following, giving users control over information access and review settings."
    },
    {
      "id": "claude-opus-5-5-built-for-coding-sessions-that-use-more-context",
      "url": "https://claude.com/blog/claude-opus-5-5-built-for-coding-sessions-that-use-more-context",
      "title": "Coding sessions are longer and use more context. Claude Opus 5.5 is built with that in mind.",
      "published_at": "2026-09-24",